id,content.rendered
711719,"
<p>DOWNTOWN — Another activist group is suing the city for being denied protest permits during this summer&#8217;s Democratic National Convention, saying in a lawsuit the city is interfering with protesters&#8217; rights to march near the convention.</p>



<p>Bodies Outside of Unjust Laws is the second coalition to sue the city over denied permits to protest outside the DNC, according to a federal lawsuit filed Thursday.</p>



<p>The coalition alleges that its First and Fourteenth Amendment rights are being violated after the city denied its permit application to protest along Michigan Avenue the day before the DNC, which will take place Aug. 19-22.</p>



<p>Bodies Outside of Unjust Laws joins three other groups who have filed suit against the city, accusing the city of seeking to stifle their constitutionally protected right to protest and giving police too broad of powers to crack down on protesters.</p>



<p>The coalition&#8217;s original route would have started at 6 p.m. Aug. 18 at Water Tower Park. From there, protesters would travel south on Michigan Avenue, west on Wacker Drive, south on State Street, east on Adams Street and south on Michigan Avenue, ending at 901 S. Michigan Ave.</p>



<p>After initial feedback from the Chicago Police Department, Bodies Outside of Unjust Laws amended their route to include less time on Michigan Avenue north of the Chicago River, according to court documents.</p>



<figure class=""wp-block-image size-large""><img data-recalc-dims=""1"" loading=""lazy"" decoding=""async"" width=""1024"" height=""853"" src=""https://i0.wp.com/bcc-newspack.s3.amazonaws.com/uploads/2024/05/Blank-1920-x-1600.jpg?resize=1024%2C853&#038;ssl=1"" alt="""" class=""wp-image-711782"" srcset=""https://i0.wp.com/bcc-newspack.s3.amazonaws.com/uploads/2024/05/Blank-1920-x-1600.jpg?resize=1024%2C853&amp;ssl=1 1024w, https://i0.wp.com/bcc-newspack.s3.amazonaws.com/uploads/2024/05/Blank-1920-x-1600.jpg?resize=300%2C250&amp;ssl=1 300w, https://i0.wp.com/bcc-newspack.s3.amazonaws.com/uploads/2024/05/Blank-1920-x-1600.jpg?resize=768%2C640&amp;ssl=1 768w, https://i0.wp.com/bcc-newspack.s3.amazonaws.com/uploads/2024/05/Blank-1920-x-1600.jpg?resize=1536%2C1280&amp;ssl=1 1536w, https://i0.wp.com/bcc-newspack.s3.amazonaws.com/uploads/2024/05/Blank-1920-x-1600.jpg?resize=1200%2C1000&amp;ssl=1 1200w, https://i0.wp.com/bcc-newspack.s3.amazonaws.com/uploads/2024/05/Blank-1920-x-1600.jpg?resize=1568%2C1307&amp;ssl=1 1568w, https://i0.wp.com/bcc-newspack.s3.amazonaws.com/uploads/2024/05/Blank-1920-x-1600.jpg?resize=400%2C333&amp;ssl=1 400w, https://i0.wp.com/bcc-newspack.s3.amazonaws.com/uploads/2024/05/Blank-1920-x-1600.jpg?resize=706%2C588&amp;ssl=1 706w, https://i0.wp.com/bcc-newspack.s3.amazonaws.com/uploads/2024/05/Blank-1920-x-1600.jpg?w=1920&amp;ssl=1 1920w, https://i0.wp.com/bcc-newspack.s3.amazonaws.com/uploads/2024/05/Blank-1920-x-1600-1024x853.jpg?w=370&amp;ssl=1 370w"" sizes=""auto, (max-width: 1000px) 100vw, 1000px"" /></figure>



<p>The city denied the amended route and offered an alternative route, which started at the southern end of Grant Park, at the corner of Columbus Drive and Roosevelt Road, before ending at Columbus Drive and Jackson Boulevard.</p>



<p>Bodies Outside of Unjust Laws rejected the alternative route as it was not within sight and sound of their intended audience: the DNC delegates staying at hotels along Michigan Avenue, organizers said at a press conference Thursday.</p>



<p>The group intends to protest in support of protecting and strengthening abortion laws and bodily autonomy.</p>



<p>&#8220;We were the first group to apply for a permit. We gave the city more than eight months&#8217; notice of our plans. But we got a rubber-stamp rejection, which was copied virtually word-for-word on all of the subsequent rejections received by groups that followed us,&#8221; Andy Thayer, an organizer with Bodies Outside of Unjust Laws, said Thursday.</p>



<figure class=""wp-block-image size-large""><img data-recalc-dims=""1"" loading=""lazy"" decoding=""async"" width=""1024"" height=""683"" src=""https://i0.wp.com/bcc-newspack.s3.amazonaws.com/uploads/2024/05/IMG_6216.jpg?resize=1024%2C683&#038;ssl=1"" alt="""" class=""wp-image-711774"" srcset=""https://i0.wp.com/bcc-newspack.s3.amazonaws.com/uploads/2024/05/IMG_6216-scaled.jpg?resize=1024%2C683&amp;ssl=1 1024w, https://i0.wp.com/bcc-newspack.s3.amazonaws.com/uploads/2024/05/IMG_6216-scaled.jpg?resize=300%2C200&amp;ssl=1 300w, https://i0.wp.com/bcc-newspack.s3.amazonaws.com/uploads/2024/05/IMG_6216-scaled.jpg?resize=768%2C512&amp;ssl=1 768w, https://i0.wp.com/bcc-newspack.s3.amazonaws.com/uploads/2024/05/IMG_6216-scaled.jpg?resize=1536%2C1024&amp;ssl=1 1536w, https://i0.wp.com/bcc-newspack.s3.amazonaws.com/uploads/2024/05/IMG_6216-scaled.jpg?resize=2048%2C1365&amp;ssl=1 2048w, https://i0.wp.com/bcc-newspack.s3.amazonaws.com/uploads/2024/05/IMG_6216-scaled.jpg?resize=1200%2C800&amp;ssl=1 1200w, https://i0.wp.com/bcc-newspack.s3.amazonaws.com/uploads/2024/05/IMG_6216-scaled.jpg?resize=1568%2C1045&amp;ssl=1 1568w, https://i0.wp.com/bcc-newspack.s3.amazonaws.com/uploads/2024/05/IMG_6216-scaled.jpg?resize=2000%2C1333&amp;ssl=1 2000w, https://i0.wp.com/bcc-newspack.s3.amazonaws.com/uploads/2024/05/IMG_6216-scaled.jpg?resize=400%2C267&amp;ssl=1 400w, https://i0.wp.com/bcc-newspack.s3.amazonaws.com/uploads/2024/05/IMG_6216-scaled.jpg?resize=706%2C471&amp;ssl=1 706w, https://i0.wp.com/bcc-newspack.s3.amazonaws.com/uploads/2024/05/IMG_6216-1024x683.jpg?w=370&amp;ssl=1 370w"" sizes=""auto, (max-width: 1000px) 100vw, 1000px"" /><figcaption class=""wp-element-caption"">Kristi Keorkunian with the Chicago chapter of Stop Trans Genocide speaks at a press conference on May 2. Keorkunian is part of a coalition suing the city for the right to march during the Democratic National Convention. <span class=""image-credit""><span class=""credit-label-wrapper"">Credit:</span> Melody Mercado, Block Club Chicago</span></figcaption></figure>



<p>The city subsequently issued the same permit denials to three other groups: the Anti-War Committee Chicago, Chicago Alliance Against Racist and Political Repression and Students for a Democratic Society.</p>



<p>All three groups applied to demonstrate during the convention and outlined different planned routes near the United Center, the main convention site. The city denied their applications, giving each group the same alternative parade route as it gave Bodies Outside of Unjust Laws.</p>



<p>Under the name March on the DNC Coalition, <a href=""https://blockclubchicago.org/2024/03/25/social-justice-groups-sue-city-over-denial-to-march-at-democratic-national-convention/"">the three social justice groups filed a joint federal lawsuit against the city in March, citing violations of the First Amendment.</a></p>



<p>The city told the groups their permits were denied because the Chicago Police Department lacked the number of officers needed for the DNC and the protests, according to the denied permit applications.</p>



<p><a href=""https://blockclubchicago.org/2024/03/19/social-justice-groups-appeal-citys-decision-to-block-democratic-national-convention-protests/"">When asked during an administrative appeal hearing in March</a>, Officer Gabriella Shemash, deputy chief of police area 3, testified that the alternative protest route proposed by the city would require significantly fewer officers and would not block a major emergency vehicle route to the Illinois Medical District.</p>



<p>Shemash, however, could not say how many officers would be required for either of the protest routes.</p>



<figure class=""wp-block-image size-large""><img data-recalc-dims=""1"" loading=""lazy"" decoding=""async"" width=""1024"" height=""683"" src=""https://i0.wp.com/bcc-newspack.s3.amazonaws.com/uploads/2024/05/IMG_6221.jpg?resize=1024%2C683&#038;ssl=1"" alt="""" class=""wp-image-711775"" srcset=""https://i0.wp.com/bcc-newspack.s3.amazonaws.com/uploads/2024/05/IMG_6221-scaled.jpg?resize=1024%2C683&amp;ssl=1 1024w, https://i0.wp.com/bcc-newspack.s3.amazonaws.com/uploads/2024/05/IMG_6221-scaled.jpg?resize=300%2C200&amp;ssl=1 300w, https://i0.wp.com/bcc-newspack.s3.amazonaws.com/uploads/2024/05/IMG_6221-scaled.jpg?resize=768%2C512&amp;ssl=1 768w, https://i0.wp.com/bcc-newspack.s3.amazonaws.com/uploads/2024/05/IMG_6221-scaled.jpg?resize=1536%2C1024&amp;ssl=1 1536w, https://i0.wp.com/bcc-newspack.s3.amazonaws.com/uploads/2024/05/IMG_6221-scaled.jpg?resize=2048%2C1365&amp;ssl=1 2048w, https://i0.wp.com/bcc-newspack.s3.amazonaws.com/uploads/2024/05/IMG_6221-scaled.jpg?resize=1200%2C800&amp;ssl=1 1200w, https://i0.wp.com/bcc-newspack.s3.amazonaws.com/uploads/2024/05/IMG_6221-scaled.jpg?resize=1568%2C1045&amp;ssl=1 1568w, https://i0.wp.com/bcc-newspack.s3.amazonaws.com/uploads/2024/05/IMG_6221-scaled.jpg?resize=2000%2C1333&amp;ssl=1 2000w, https://i0.wp.com/bcc-newspack.s3.amazonaws.com/uploads/2024/05/IMG_6221-scaled.jpg?resize=400%2C267&amp;ssl=1 400w, https://i0.wp.com/bcc-newspack.s3.amazonaws.com/uploads/2024/05/IMG_6221-scaled.jpg?resize=706%2C471&amp;ssl=1 706w, https://i0.wp.com/bcc-newspack.s3.amazonaws.com/uploads/2024/05/IMG_6221-1024x683.jpg?w=370&amp;ssl=1 370w"" sizes=""auto, (max-width: 1000px) 100vw, 1000px"" /><figcaption class=""wp-element-caption"">Andy Thayer with Bodies Outside of Unjust Bodies calls out the city for denying organizations permits to march at the Democratic National Convention. <span class=""image-credit""><span class=""credit-label-wrapper"">Credit:</span> Melody Mercado, Block Club Chicago</span></figcaption></figure>



<p>Bodies Outside of Unjust Laws said the same vague answers were given to them during the group&#8217;s administrative appeal hearing in January, according to the lawsuit. </p>



<p>Unsatisfied with the city&#8217;s response, the coalition filed its federal lawsuit Thursday.</p>



<p>&#8220;Rather than make room for speech, Chicago has denied our clients and others permits to march where delegates can see them. These permit denials are unconstitutional,&#8221; said Rebecca Glenberg, senior supervising attorney at the ACLU of Illinois.</p>



<p>The Mayor&#8217;s Office declined to comment on the lawsuit, referring questions to the Department of Law.</p>



<p>&#8220;The City has not been served with the complaint and does not comment on pending litigation,&#8221; Kristen Cabanan, a spokesperson from the law department, said in an email.</p>



<p>Representatives from the Secret Service, FBI, Chicago Police Department, Chicago’s Office of Emergency Management and the Chicago 2024 Host Committee have already started <a href=""https://blockclubchicago.org/2024/04/09/secret-service-meets-with-south-loop-businesses-about-dncs-security-impact/"">canvassing the areas around the United Center and McCormick Place, </a>where the convention will be held.</p>



<p>The DNC is considered a “national special security event,” which means the Secret Service will be in charge of safety inside the designated footprint of the convention at the United Center and McCormick Place. Chicago police will be in charge of safety outside the footprint.</p>



<p>Last month, the Secret Service released tentative maps showing the areas around the United Center and McCormick Place that could be affected by the security footprint. The final footprint will be released in July, officials said.</p>



<figure class=""wp-block-image size-large""><img data-recalc-dims=""1"" loading=""lazy"" decoding=""async"" width=""1024"" height=""683"" src=""https://i0.wp.com/bcc-newspack.s3.amazonaws.com/uploads/2024/04/IMG_6192.jpg?resize=1024%2C683&#038;ssl=1"" alt="""" class=""wp-image-701417"" srcset=""https://i0.wp.com/bcc-newspack.s3.amazonaws.com/uploads/2024/04/IMG_6192-scaled.jpg?resize=1024%2C683&amp;ssl=1 1024w, https://i0.wp.com/bcc-newspack.s3.amazonaws.com/uploads/2024/04/IMG_6192-scaled.jpg?resize=300%2C200&amp;ssl=1 300w, https://i0.wp.com/bcc-newspack.s3.amazonaws.com/uploads/2024/04/IMG_6192-scaled.jpg?resize=768%2C512&amp;ssl=1 768w, https://i0.wp.com/bcc-newspack.s3.amazonaws.com/uploads/2024/04/IMG_6192-scaled.jpg?resize=1536%2C1024&amp;ssl=1 1536w, https://i0.wp.com/bcc-newspack.s3.amazonaws.com/uploads/2024/04/IMG_6192-scaled.jpg?resize=2048%2C1365&amp;ssl=1 2048w, https://i0.wp.com/bcc-newspack.s3.amazonaws.com/uploads/2024/04/IMG_6192-scaled.jpg?resize=1200%2C800&amp;ssl=1 1200w, https://i0.wp.com/bcc-newspack.s3.amazonaws.com/uploads/2024/04/IMG_6192-scaled.jpg?resize=1568%2C1045&amp;ssl=1 1568w, https://i0.wp.com/bcc-newspack.s3.amazonaws.com/uploads/2024/04/IMG_6192-scaled.jpg?resize=2000%2C1333&amp;ssl=1 2000w, https://i0.wp.com/bcc-newspack.s3.amazonaws.com/uploads/2024/04/IMG_6192-scaled.jpg?resize=400%2C267&amp;ssl=1 400w, https://i0.wp.com/bcc-newspack.s3.amazonaws.com/uploads/2024/04/IMG_6192-scaled.jpg?resize=706%2C471&amp;ssl=1 706w, https://i0.wp.com/bcc-newspack.s3.amazonaws.com/uploads/2024/04/IMG_6192-1024x683.jpg?w=370&amp;ssl=1 370w"" sizes=""auto, (max-width: 1000px) 100vw, 1000px"" /><figcaption class=""wp-element-caption"">Members of the Chicago Police Department, FBI and Secret Service canvass the neighborhood surrounding the McCormick Center ahead of the Democratic National Convention. <span class=""image-credit""><span class=""credit-label-wrapper"">Credit:</span> Melody Mercado, Block Club Chicago</span></figcaption></figure>



<p>On April 17, City Council <a href=""https://occprodstoragev1.blob.core.usgovcloudapi.net/matterattachmentspublic/b72e139b-6f6b-474e-971c-1c526f7f3ad6.pdf"">passed an ordinance introduced by</a> Mayor Brandon Johnson that prohibits protesters, residents and other onlookers&nbsp;from bringing laptops, large bags, scooters, animals (except for service dogs), unmanned aircraft systems and other items into the DNC&#8217;s security footprint.</p>



<p>The ordinance also gives the police department <a href=""https://occprodstoragev1.blob.core.usgovcloudapi.net/matterattachmentspublic/35819cc4-9927-40d3-a371-31c991051036.pdf"">the power to deem any item hazardous</a>. Those violating the ordinance could face fines between $100-$500, imprisonment between 10 days to six months or both, according to the ordinance.</p>



<p>The lawsuit filed by Bodies Outside of Unjust Laws argues that the ordinance &#8220;contains no guidelines for law enforcement to ensure that its application is not arbitrary or discriminatory.&#8221;</p>



<p>&#8220;[Johnson is] going against his promises of an open city government and doing this. A government for the people &#8230; it&#8217;s extremely disappointing. And I say that as someone who voted for Mayor Johnson,&#8221; Thayer said.</p>



<p>Police Superintendent Larry Snelling said during a community town hall Tuesday the police department will be out during the DNC to make sure that those who want to protest during the convention &#8220;<a href=""https://www.fox32chicago.com/news/chicago-police-superintendent-addresses-campus-protests-ahead-of-dnc"">can exercise their First Amendment right as long as they are doing it peacefully&#8221; without &#8220;violence, looting or vandalism</a>.&#8221;</p>



<p>The police department did not respond to questions from Block Club about whether or not Snelling&#8217;s comments apply to those who decide to march without a permit.</p>



<p>Bodies Outside of Unjust Laws said Thursday they plan to march with or without a permit.</p>



<hr class=""wp-block-separator has-text-color has-primary-color has-alpha-channel-opacity has-primary-background-color has-background is-style-wide""/>



<div class=""wp-block-group""><div class=""wp-block-group__inner-container is-layout-constrained wp-block-group-is-layout-constrained"">
<div class=""wp-block-group is-vertical is-layout-flex wp-container-core-group-is-layout-8cad6afd wp-block-group-is-layout-flex"">
<p class=""has-large-font-size""><strong>Support Local News!</strong></p>



<p><strong><a href=""https://blockclubchicago.org/subscribe/"">Subscribe to Block Club Chicago</a>, </strong>an independent, 501(c)(3), journalist-run newsroom. Every dime we make funds reporting from Chicago’s neighborhoods. Already subscribe? <strong><a href=""https://blockclubchicago.org/gift-subscriptions/"" target=""_blank"" rel=""noreferrer noopener"">Click here to gift a subscription</a></strong>, or you can<strong> support Block Club with a <a href=""https://blockclubchicago.org/donate/"">tax-deductible donation.</a></strong></p>
</div>



<p></p>
</div></div>



<p><strong>Listen to the Block Club Chicago podcast:</strong></p>


			<style type=""text/css"">#pp-podcast-7572 a, .pp-modal-window .modal-7572 a, .pp-modal-window .aux-modal-7572 a, #pp-podcast-7572 .ppjs__more { color: #e94c21; } #pp-podcast-7572:not(.modern) .ppjs__audio .ppjs__button.ppjs__playpause-button button *, #pp-podcast-7572:not(.modern) .ppjs__audio .ppjs__button.ppjs__playpause-button button:hover *, #pp-podcast-7572:not(.modern) .ppjs__audio .ppjs__button.ppjs__playpause-button button:focus *, .pp-modal-window .modal-7572 .ppjs__audio .ppjs__button.ppjs__playpause-button button *, .pp-modal-window .modal-7572 .ppjs__audio .ppjs__button.ppjs__playpause-button button:hover *, .pp-modal-window .modal-7572 .ppjs__audio .ppjs__button.ppjs__playpause-button button:focus *, .pp-modal-window .aux-modal-7572 .pod-entry__play *, .pp-modal-window .aux-modal-7572 .pod-entry__play:hover * { color: #e94c21 !important; } #pp-podcast-7572.postview .episode-list__load-more, .pp-modal-window .aux-modal-7572 .episode-list__load-more, #pp-podcast-7572:not(.modern) .ppjs__time-handle-content, .modal-7572 .ppjs__time-handle-content { border-color: #e94c21 !important; } #pp-podcast-7572:not(.modern) .ppjs__audio-time-rail, #pp-podcast-7572.lv3 .pod-entry__play, #pp-podcast-7572.lv4 .pod-entry__play, #pp-podcast-7572.gv2 .pod-entry__play, #pp-podcast-7572.modern.wide-player .ppjs__audio .ppjs__button.ppjs__playpause-button button, #pp-podcast-7572.modern.wide-player .ppjs__audio .ppjs__button.ppjs__playpause-button button:hover, #pp-podcast-7572.modern.wide-player .ppjs__audio .ppjs__button.ppjs__playpause-button button:focus, .pp-modal-window .modal-7572 button.episode-list__load-more, .pp-modal-window .modal-7572 .ppjs__audio-time-rail, .pp-modal-window .modal-7572 button.pp-modal-close { background-color: #e94c21 !important; } #pp-podcast-7572 .hasCover .ppjs__audio .ppjs__button.ppjs__playpause-button button { background-color: rgba(0, 0, 0, 0.5) !important; } .pp-modal-window .modal-7572 button.episode-list__load-more:hover, .pp-modal-window .modal-7572 button.episode-list__load-more:focus, .pp-modal-window .aux-modal-7572 button.episode-list__load-more:hover, .pp-modal-window .aux-modal-7572 button.episode-list__load-more:focus { background-color: rgba( 233,76,33, 0.7 ) !important; } #pp-podcast-7572 .ppjs__button.toggled-on, .pp-modal-window .modal-7572 .ppjs__button.toggled-on, #pp-podcast-7572.playerview .pod-entry.activeEpisode, .pp-modal-window .modal-7572.playerview .pod-entry.activeEpisode { background-color: rgba( 233,76,33, 0.1 ); } #pp-podcast-7572.postview .episode-list__load-more { background-color: transparent !important; } #pp-podcast-7572.modern:not(.wide-player) .ppjs__audio .ppjs__button.ppjs__playpause-button button *, #pp-podcast-7572.modern:not(.wide-player) .ppjs__audio .ppjs__button.ppjs__playpause-button button:hover *, #pp-podcast-7572.modern:not(.wide-player) .ppjs__audio .ppjs__button.ppjs__playpause-button button:focus * { color: #e94c21 !important; } #pp-podcast-7572.modern:not(.wide-player) .ppjs__time-handle-content { border-color: #e94c21 !important; } #pp-podcast-7572.modern:not(.wide-player) .ppjs__audio-time-rail { background-color: #e94c21 !important; } #pp-podcast-7572, .modal-7572, .aux-modal-7572 { --pp-accent-color: #e94c21; } #pp-podcast-7572 .ppjs__script-button { display: none; } #pp-podcast-7572 .pod-entry__author { display: none; } #pp-podcast-7572 .pod-info__header { display: block; }</style>
